{
  "schema_version": 1,
  "id": "toml-c-emit-2026-10-21",
  "language": "c",
  "subject": {
    "name": "teptris",
    "version": "0.3.7 (main, Release + LTO)"
  },
  "harness": {
    "label": "bench_parse emit columns \u2014 every library serializes the parsed document back to TOML, min of 10",
    "url": "https://github.com/leptris/teptris/tree/main/benchmarks"
  },
  "machine": "Apple M1 Max, macOS 14.1.1, arm64",
  "date": "2026-10-21",
  "stat": "min of 10 (Release + LTO); only the competitors with serializers are tabled (tomlc99/tomlc17/cpptoml have none)",
  "results": [
    {
      "tech": "toml",
      "operation": "emit-array-heavy",
      "operation_label": "Emit \u2014 array heavy",
      "competitor": "toml11",
      "competitor_version": "4.2.0",
      "leptris_value": 1.226,
      "unit": "ms",
      "ratio": 495.44,
      "status": "win",
      "competitor_value": 607.158
    },
    {
      "tech": "toml",
      "operation": "emit-array-heavy",
      "operation_label": "Emit \u2014 array heavy",
      "competitor": "tomlplusplus",
      "competitor_version": "3.4.0",
      "leptris_value": 1.226,
      "unit": "ms",
      "ratio": 35.06,
      "status": "win",
      "competitor_value": 42.969
    },
    {
      "tech": "toml",
      "operation": "emit-cargo-like",
      "operation_label": "Emit \u2014 cargo like",
      "competitor": "toml11",
      "competitor_version": "4.2.0",
      "leptris_value": 0.738,
      "unit": "ms",
      "ratio": 40.27,
      "status": "win",
      "competitor_value": 29.733
    },
    {
      "tech": "toml",
      "operation": "emit-cargo-like",
      "operation_label": "Emit \u2014 cargo like",
      "competitor": "tomlplusplus",
      "competitor_version": "3.4.0",
      "leptris_value": 0.738,
      "unit": "ms",
      "ratio": 3.2,
      "status": "win",
      "competitor_value": 2.364
    },
    {
      "tech": "toml",
      "operation": "emit-datetime-heavy",
      "operation_label": "Emit \u2014 datetime heavy",
      "competitor": "toml11",
      "competitor_version": "4.2.0",
      "leptris_value": 1.41,
      "unit": "ms",
      "ratio": 66.1,
      "status": "win",
      "competitor_value": 93.178
    },
    {
      "tech": "toml",
      "operation": "emit-datetime-heavy",
      "operation_label": "Emit \u2014 datetime heavy",
      "competitor": "tomlplusplus",
      "competitor_version": "3.4.0",
      "leptris_value": 1.41,
      "unit": "ms",
      "ratio": 56.84,
      "status": "win",
      "competitor_value": 80.123
    },
    {
      "tech": "toml",
      "operation": "emit-deep-tables",
      "operation_label": "Emit \u2014 deep tables",
      "competitor": "toml11",
      "competitor_version": "4.2.0",
      "leptris_value": 0.465,
      "unit": "ms",
      "ratio": 59.44,
      "status": "win",
      "competitor_value": 27.634
    },
    {
      "tech": "toml",
      "operation": "emit-deep-tables",
      "operation_label": "Emit \u2014 deep tables",
      "competitor": "tomlplusplus",
      "competitor_version": "3.4.0",
      "leptris_value": 0.465,
      "unit": "ms",
      "ratio": 4.62,
      "status": "win",
      "competitor_value": 2.15
    },
    {
      "tech": "toml",
      "operation": "emit-mixed",
      "operation_label": "Emit \u2014 mixed",
      "competitor": "toml11",
      "competitor_version": "4.2.0",
      "leptris_value": 1.198,
      "unit": "ms",
      "ratio": 23.98,
      "status": "win",
      "competitor_value": 28.722
    },
    {
      "tech": "toml",
      "operation": "emit-mixed",
      "operation_label": "Emit \u2014 mixed",
      "competitor": "tomlplusplus",
      "competitor_version": "3.4.0",
      "leptris_value": 1.198,
      "unit": "ms",
      "ratio": 6.53,
      "status": "win",
      "competitor_value": 7.815
    },
    {
      "tech": "toml",
      "operation": "emit-scalar-float",
      "operation_label": "Emit \u2014 scalar float",
      "competitor": "toml11",
      "competitor_version": "4.2.0",
      "leptris_value": 5.559,
      "unit": "ms",
      "ratio": 14.75,
      "status": "win",
      "competitor_value": 81.974
    },
    {
      "tech": "toml",
      "operation": "emit-scalar-float",
      "operation_label": "Emit \u2014 scalar float",
      "competitor": "tomlplusplus",
      "competitor_version": "3.4.0",
      "leptris_value": 5.559,
      "unit": "ms",
      "ratio": 6.92,
      "status": "win",
      "competitor_value": 38.484
    },
    {
      "tech": "toml",
      "operation": "emit-scalar-int",
      "operation_label": "Emit \u2014 scalar int",
      "competitor": "toml11",
      "competitor_version": "4.2.0",
      "leptris_value": 2.405,
      "unit": "ms",
      "ratio": 27.31,
      "status": "win",
      "competitor_value": 65.678
    },
    {
      "tech": "toml",
      "operation": "emit-scalar-int",
      "operation_label": "Emit \u2014 scalar int",
      "competitor": "tomlplusplus",
      "competitor_version": "3.4.0",
      "leptris_value": 2.405,
      "unit": "ms",
      "ratio": 7.34,
      "status": "win",
      "competitor_value": 17.657
    },
    {
      "tech": "toml",
      "operation": "emit-scalar-string",
      "operation_label": "Emit \u2014 scalar string",
      "competitor": "toml11",
      "competitor_version": "4.2.0",
      "leptris_value": 2.115,
      "unit": "ms",
      "ratio": 18.58,
      "status": "win",
      "competitor_value": 39.297
    },
    {
      "tech": "toml",
      "operation": "emit-scalar-string",
      "operation_label": "Emit \u2014 scalar string",
      "competitor": "tomlplusplus",
      "competitor_version": "3.4.0",
      "leptris_value": 2.115,
      "unit": "ms",
      "ratio": 3.1,
      "status": "win",
      "competitor_value": 6.552
    },
    {
      "tech": "toml",
      "operation": "emit-table-heavy",
      "operation_label": "Emit \u2014 table heavy",
      "competitor": "toml11",
      "competitor_version": "4.2.0",
      "leptris_value": 3.107,
      "unit": "ms",
      "ratio": 22.96,
      "status": "win",
      "competitor_value": 71.355
    },
    {
      "tech": "toml",
      "operation": "emit-table-heavy",
      "operation_label": "Emit \u2014 table heavy",
      "competitor": "tomlplusplus",
      "competitor_version": "3.4.0",
      "leptris_value": 3.107,
      "unit": "ms",
      "ratio": 5.0,
      "status": "win",
      "competitor_value": 15.522
    }
  ]
}