{
  "schema_version": 1,
  "id": "xml-python-2026-09-12",
  "language": "python",
  "subject": { "name": "leptris", "version": "1.9.121.0 (binding) on libleptris 1.9.143-dev" },
  "harness": {
    "label": "benchmarks/matrix.py — same fixtures as the Ruby matrix",
    "url": "https://github.com/leptris/leptris-py/blob/main/benchmarks/matrix.py"
  },
  "machine": "Apple M1 Max, macOS 14.1.1, arm64; Python 3.10.5",
  "date": "2026-09-12",
  "stat": "mean per iteration",
  "results": [
    {
      "tech": "xml",
      "operation": "parse-small",
      "operation_label": "Parse small (431 B)",
      "competitor": "lxml",
      "competitor_version": "6.0.2",
      "leptris_value": 4.25,
      "competitor_value": 5.64,
      "unit": "µs",
      "ratio": 1.33,
      "status": "win"
    },
    {
      "tech": "xml",
      "operation": "parse-medium",
      "operation_label": "Parse medium (12 KB)",
      "competitor": "lxml",
      "competitor_version": "6.0.2",
      "leptris_value": 22.61,
      "competitor_value": 104.85,
      "unit": "µs",
      "ratio": 4.64,
      "status": "win"
    },
    {
      "tech": "html",
      "operation": "parse-html",
      "operation_label": "Parse HTML (200-div page)",
      "competitor": "lxml",
      "competitor_version": "6.0.2",
      "leptris_value": 72.05,
      "competitor_value": 190.4,
      "unit": "µs",
      "ratio": 2.64,
      "status": "win"
    },
    {
      "tech": "xpath",
      "operation": "xpath-count",
      "operation_label": "XPath count(//book)",
      "competitor": "lxml",
      "competitor_version": "6.0.2",
      "leptris_value": 1.55,
      "competitor_value": 8.06,
      "unit": "µs",
      "ratio": 5.2,
      "status": "win"
    },
    {
      "tech": "xpath",
      "operation": "xpath-nodeset",
      "operation_label": "XPath //book (100 nodes)",
      "competitor": "lxml",
      "competitor_version": "6.0.2",
      "leptris_value": 3.3,
      "competitor_value": 11.79,
      "unit": "µs",
      "ratio": 3.57,
      "status": "win"
    },
    {
      "tech": "xpath",
      "operation": "xpath-predicate",
      "operation_label": "XPath //book[@id='50']",
      "competitor": "lxml",
      "competitor_version": "6.0.2",
      "leptris_value": 1.87,
      "competitor_value": 36.05,
      "unit": "µs",
      "ratio": 19.28,
      "status": "win"
    },
    {
      "tech": "xpath",
      "operation": "xpath-complex",
      "operation_label": "XPath //book[price > 50]",
      "competitor": "lxml",
      "competitor_version": "6.0.2",
      "leptris_value": 5.8,
      "competitor_value": 50.1,
      "unit": "µs",
      "ratio": 8.64,
      "status": "win"
    },
    {
      "tech": "xpath",
      "operation": "xpath-union",
      "operation_label": "XPath //author | //title",
      "competitor": "lxml",
      "competitor_version": "6.0.2",
      "leptris_value": 9.67,
      "competitor_value": 27.54,
      "unit": "µs",
      "ratio": 2.85,
      "status": "win"
    },
    {
      "tech": "xpath",
      "operation": "xpath-vars",
      "operation_label": "XPath //book[@id=$id] (variable-bound)",
      "competitor": "lxml",
      "competitor_version": "6.0.2",
      "leptris_value": 7.42,
      "competitor_value": 37.09,
      "unit": "µs",
      "ratio": 5.0,
      "status": "win"
    },
    {
      "tech": "xml",
      "operation": "traversal",
      "operation_label": "Traversal (401 elements)",
      "competitor": "lxml",
      "competitor_version": "6.0.2",
      "leptris_value": 9.86,
      "competitor_value": 19.35,
      "unit": "µs",
      "ratio": 1.96,
      "status": "win"
    },
    {
      "tech": "xml",
      "operation": "traversal",
      "operation_label": "Traversal (401 elements)",
      "competitor": "elementtree",
      "competitor_version": "stdlib 3.10.5",
      "leptris_value": 9.86,
      "competitor_value": 3.4,
      "unit": "µs",
      "ratio": 0.34,
      "status": "loss",
      "note": "ElementTree's iter() is a bare generator over a lean list — the stdlib's one crown; everything else it does is 2-23x behind"
    },
    {
      "tech": "xml",
      "operation": "serialize",
      "operation_label": "Serialize",
      "competitor": "lxml",
      "competitor_version": "6.0.2",
      "leptris_value": 24.31,
      "competitor_value": 56.52,
      "unit": "µs",
      "ratio": 2.32,
      "status": "win"
    },
    {
      "tech": "xml",
      "operation": "serialize",
      "operation_label": "Serialize",
      "competitor": "elementtree",
      "competitor_version": "stdlib 3.10.5",
      "leptris_value": 24.31,
      "competitor_value": 565.07,
      "unit": "µs",
      "ratio": 23.24,
      "status": "win"
    },
    {
      "tech": "xml",
      "operation": "serialize",
      "operation_label": "Serialize",
      "competitor": "minidom",
      "competitor_version": "stdlib 3.10.5",
      "leptris_value": 24.31,
      "competitor_value": 561.79,
      "unit": "µs",
      "ratio": 23.1,
      "status": "win"
    },
    {
      "tech": "xml",
      "operation": "parse-small",
      "operation_label": "Parse small (431 B)",
      "competitor": "elementtree",
      "competitor_version": "stdlib 3.10.5",
      "leptris_value": 4.25,
      "competitor_value": 7.93,
      "unit": "µs",
      "ratio": 1.87,
      "status": "win"
    },
    {
      "tech": "xml",
      "operation": "parse-medium",
      "operation_label": "Parse medium (12 KB)",
      "competitor": "elementtree",
      "competitor_version": "stdlib 3.10.5",
      "leptris_value": 22.61,
      "competitor_value": 158.25,
      "unit": "µs",
      "ratio": 7.0,
      "status": "win"
    },
    {
      "tech": "xml",
      "operation": "parse-small",
      "operation_label": "Parse small (431 B)",
      "competitor": "minidom",
      "competitor_version": "stdlib 3.10.5",
      "leptris_value": 4.25,
      "competitor_value": 54.32,
      "unit": "µs",
      "ratio": 12.78,
      "status": "win"
    }
  ]
}
