{
  "schema_version": 1,
  "id": "xml-c-matrix-2026-09-12",
  "language": "c",
  "subject": {
    "name": "libleptris",
    "version": "1.9.143-dev (main eea85cf)"
  },
  "harness": {
    "label": "bench_matrix — same fixtures, same iteration protocol, all three libraries",
    "url": "https://github.com/leptris/leptris/tree/main/benchmarks/matrix"
  },
  "machine": "Apple M1 Max, macOS 14.1.1, arm64",
  "date": "2026-09-12",
  "stat": "min of 20 (Release + LTO)",
  "results": [
    {
      "tech": "xml",
      "operation": "dom-parse-text-heavy-2mb",
      "operation_label": "DOM parse — text-heavy 2 MB",
      "competitor": "pugixml",
      "competitor_version": "1.16",
      "leptris_value": 191,
      "competitor_value": 642,
      "unit": "µs",
      "ratio": 3.36,
      "status": "win"
    },
    {
      "tech": "xml",
      "operation": "dom-parse-text-heavy-2mb",
      "operation_label": "DOM parse — text-heavy 2 MB",
      "competitor": "libxml2",
      "competitor_version": "2.9.13 (SDK)",
      "leptris_value": 191,
      "competitor_value": 966,
      "unit": "µs",
      "ratio": 5.06,
      "status": "win"
    },
    {
      "tech": "xml",
      "operation": "dom-parse-attr-heavy-5k",
      "operation_label": "DOM parse — attr-heavy (5k attrs, 559 KB)",
      "competitor": "pugixml",
      "competitor_version": "1.16",
      "leptris_value": 2070,
      "competitor_value": 417,
      "unit": "µs",
      "ratio": 0.2,
      "status": "loss",
      "note": "the parse wall on this shape: single-pass at a compiler-global optimum is ~5x behind pugixml's zero-copy attr handling; no known lever"
    },
    {
      "tech": "xml",
      "operation": "dom-parse-attr-heavy-5k",
      "operation_label": "DOM parse — attr-heavy (5k attrs, 559 KB)",
      "competitor": "libxml2",
      "competitor_version": "2.9.13 (SDK)",
      "leptris_value": 2070,
      "competitor_value": 7985,
      "unit": "µs",
      "ratio": 3.86,
      "status": "win"
    },
    {
      "tech": "xml",
      "operation": "dom-parse-pretty-ws-1mb",
      "operation_label": "DOM parse — pretty-printed 1 MB",
      "competitor": "pugixml",
      "competitor_version": "1.16",
      "leptris_value": 2449,
      "competitor_value": 1217,
      "unit": "µs",
      "ratio": 0.5,
      "status": "loss",
      "note": "apples-to-apples caveat: leptris keeps whitespace-only text nodes (libxml2/Nokogiri semantics) while pugixml discards them; LEPTRIS_PARSE_DROP_WS_TEXT closes most of this gap on pretty shapes"
    },
    {
      "tech": "xml",
      "operation": "dom-parse-pretty-ws-1mb",
      "operation_label": "DOM parse — pretty-printed 1 MB",
      "competitor": "libxml2",
      "competitor_version": "2.9.13 (SDK)",
      "leptris_value": 2449,
      "competitor_value": 23024,
      "unit": "µs",
      "ratio": 9.4,
      "status": "win"
    },
    {
      "tech": "xml",
      "operation": "dom-parse-catalog-5000",
      "operation_label": "DOM parse — catalog (5000 items, 367 KB)",
      "competitor": "pugixml",
      "competitor_version": "1.16",
      "leptris_value": 504,
      "competitor_value": 331,
      "unit": "µs",
      "ratio": 0.66,
      "status": "loss",
      "note": "mixed-content shapes carry the index bookkeeping pugixml skips"
    },
    {
      "tech": "xml",
      "operation": "dom-parse-catalog-5000",
      "operation_label": "DOM parse — catalog (5000 items, 367 KB)",
      "competitor": "libxml2",
      "competitor_version": "2.9.13 (SDK)",
      "leptris_value": 504,
      "competitor_value": 3558,
      "unit": "µs",
      "ratio": 7.06,
      "status": "win"
    },
    {
      "tech": "xml",
      "operation": "sax-parse-text-heavy-2mb",
      "operation_label": "SAX parse — text-heavy 2 MB",
      "competitor": "libxml2",
      "competitor_version": "2.9.13 (SDK)",
      "leptris_value": 905,
      "competitor_value": 859,
      "unit": "µs",
      "ratio": 0.95,
      "status": "parity"
    },
    {
      "tech": "xml",
      "operation": "sax-parse-attr-heavy-5k",
      "operation_label": "SAX parse — attr-heavy (5k attrs)",
      "competitor": "libxml2",
      "competitor_version": "2.9.13 (SDK)",
      "leptris_value": 2996,
      "competitor_value": 2311,
      "unit": "µs",
      "ratio": 0.77,
      "status": "loss"
    },
    {
      "tech": "xml",
      "operation": "sax-parse-pretty-ws-1mb",
      "operation_label": "SAX parse — pretty-printed 1 MB",
      "competitor": "libxml2",
      "competitor_version": "2.9.13 (SDK)",
      "leptris_value": 4173,
      "competitor_value": 5757,
      "unit": "µs",
      "ratio": 1.38,
      "status": "win"
    },
    {
      "tech": "xml",
      "operation": "sax-parse-catalog-5000",
      "operation_label": "SAX parse — catalog (5000 items)",
      "competitor": "libxml2",
      "competitor_version": "2.9.13 (SDK)",
      "leptris_value": 1189,
      "competitor_value": 1136,
      "unit": "µs",
      "ratio": 0.95,
      "status": "parity"
    },
    {
      "tech": "xml",
      "operation": "serialize-attr-heavy",
      "operation_label": "Serialize — attr-heavy 559 KB",
      "competitor": "pugixml",
      "competitor_version": "1.16",
      "leptris_value": 492,
      "competitor_value": 621,
      "unit": "µs",
      "ratio": 1.26,
      "status": "win"
    },
    {
      "tech": "xml",
      "operation": "serialize-text-heavy",
      "operation_label": "Serialize — text-heavy 2 MB",
      "competitor": "pugixml",
      "competitor_version": "1.16",
      "leptris_value": 1080,
      "competitor_value": 657,
      "unit": "µs",
      "ratio": 0.61,
      "status": "loss",
      "note": "pugixml's zero-copy text spans win the pure-text shape; the 32-byte split-stream attr design carries its cost here"
    },
    {
      "tech": "xml",
      "operation": "mutation-append-10k",
      "operation_label": "Append 10,000 children",
      "competitor": "pugixml",
      "competitor_version": "1.16",
      "leptris_value": 377,
      "competitor_value": 119,
      "unit": "µs",
      "ratio": 0.32,
      "status": "loss",
      "note": "doc-level index bookkeeping — the price of the O(1) duplicate-rejecting index at scale"
    },
    {
      "tech": "xml",
      "operation": "mutation-append-10k",
      "operation_label": "Append 10,000 children",
      "competitor": "libxml2",
      "competitor_version": "2.9.13 (SDK)",
      "leptris_value": 377,
      "competitor_value": 544,
      "unit": "µs",
      "ratio": 1.44,
      "status": "win"
    },
    {
      "tech": "xml",
      "operation": "mutation-set-attr-2k",
      "operation_label": "Set 2,000 attributes (duplicate-rejecting)",
      "competitor": "pugixml",
      "competitor_version": "1.16",
      "leptris_value": 480,
      "competitor_value": 198,
      "unit": "µs",
      "ratio": 0.41,
      "status": "loss",
      "note": "per-attr hash insert on tiny attrs; pugixml appends raw"
    },
    {
      "tech": "xml",
      "operation": "mutation-set-attr-2k",
      "operation_label": "Set 2,000 attributes (duplicate-rejecting)",
      "competitor": "libxml2",
      "competitor_version": "2.9.13 (SDK)",
      "leptris_value": 480,
      "competitor_value": 9156,
      "unit": "µs",
      "ratio": 19.08,
      "status": "win"
    }
  ]
}
